{
  "$schema": "https://json-schema.org/draft/2020-12/schema",
  "$id": "https://frankensqlite.local/schemas/sample_sqlite_db_files/beads_benchmark_campaign.v1.schema.json",
  "title": "FrankenSQLite Beads Benchmark Campaign (v1)",
  "type": "object",
  "additionalProperties": false,
  "required": [
    "schema_version",
    "campaign_id",
    "title",
    "working_benchmark_root_relpath",
    "beads_data_relpath",
    "fixtures",
    "placement_profiles",
    "hardware_classes",
    "retry_policies",
    "build_profiles",
    "seed_policies",
    "matrix_rows",
    "artifact_contract"
  ],
  "properties": {
    "schema_version": {
      "type": "string",
      "const": "fsqlite-e2e.beads_benchmark_campaign.v1"
    },
    "campaign_id": {
      "$ref": "#/$defs/id"
    },
    "title": {
      "$ref": "#/$defs/non_empty_string"
    },
    "working_benchmark_root_relpath": {
      "$ref": "#/$defs/non_empty_string"
    },
    "beads_data_relpath": {
      "$ref": "#/$defs/non_empty_string"
    },
    "fixtures": {
      "type": "array",
      "minItems": 1,
      "items": {
        "$ref": "#/$defs/fixture"
      }
    },
    "placement_profiles": {
      "type": "array",
      "minItems": 1,
      "items": {
        "$ref": "#/$defs/placement_profile"
      }
    },
    "hardware_classes": {
      "type": "array",
      "minItems": 1,
      "items": {
        "$ref": "#/$defs/hardware_class"
      }
    },
    "retry_policies": {
      "type": "array",
      "minItems": 1,
      "items": {
        "$ref": "#/$defs/retry_policy"
      }
    },
    "build_profiles": {
      "type": "array",
      "minItems": 1,
      "items": {
        "$ref": "#/$defs/build_profile"
      }
    },
    "seed_policies": {
      "type": "array",
      "minItems": 1,
      "items": {
        "$ref": "#/$defs/seed_policy"
      }
    },
    "matrix_rows": {
      "type": "array",
      "minItems": 1,
      "items": {
        "$ref": "#/$defs/matrix_row"
      }
    },
    "artifact_contract": {
      "$ref": "#/$defs/artifact_contract"
    }
  },
  "$defs": {
    "non_empty_string": {
      "type": "string",
      "minLength": 1
    },
    "id": {
      "type": "string",
      "pattern": "^[a-z0-9][a-z0-9_\\-\\.]*$"
    },
    "sha256": {
      "type": "string",
      "pattern": "^[0-9a-f]{64}$"
    },
    "benchmark_mode": {
      "type": "string",
      "enum": ["sqlite_reference", "fsqlite_mvcc", "fsqlite_single_writer"]
    },
    "placement_profile_kind": {
      "type": "string",
      "enum": ["baseline", "recommended_pinned", "adversarial_topology"]
    },
    "placement_profile_availability": {
      "type": "string",
      "enum": ["universal", "topology_aware"]
    },
    "placement_cpu_affinity_policy": {
      "type": "string",
      "enum": [
        "scheduler_default",
        "dedicated_local_one_thread_per_core",
        "split_across_locality_domains"
      ]
    },
    "placement_smt_policy": {
      "type": "string",
      "enum": ["host_default", "one_thread_per_core", "avoid_primary_sibling_reuse"]
    },
    "placement_memory_policy": {
      "type": "string",
      "enum": ["host_default", "bind_local", "match_cross_domain_placement"]
    },
    "placement_helper_lane_policy": {
      "type": "string",
      "enum": [
        "disclose_host_default",
        "same_locality_housekeeping_core",
        "outside_primary_worker_domains"
      ]
    },
    "placement_suite_selector_kind": {
      "type": "string",
      "enum": ["matrix_placement_variant"]
    },
    "placement_focused_rerun_selector_kind": {
      "type": "string",
      "enum": ["explicit_bindings"]
    },
    "placement_violation_disposition": {
      "type": "string",
      "enum": ["not_comparable"]
    },
    "placement_suite_selection_contract": {
      "type": "object",
      "additionalProperties": false,
      "required": ["selector_kind", "selector_field"],
      "properties": {
        "selector_kind": {
          "$ref": "#/$defs/placement_suite_selector_kind"
        },
        "selector_field": {
          "$ref": "#/$defs/non_empty_string"
        }
      }
    },
    "placement_focused_rerun_contract": {
      "type": "object",
      "additionalProperties": false,
      "required": ["selector_kind", "required_bindings"],
      "properties": {
        "selector_kind": {
          "$ref": "#/$defs/placement_focused_rerun_selector_kind"
        },
        "required_bindings": {
          "type": "array",
          "minItems": 1,
          "items": {
            "$ref": "#/$defs/non_empty_string"
          }
        }
      }
    },
    "placement_claim_contract": {
      "type": "object",
      "additionalProperties": false,
      "required": ["mandatory_for", "optional_for", "avoid_for"],
      "properties": {
        "mandatory_for": {
          "type": "array",
          "minItems": 1,
          "items": {
            "$ref": "#/$defs/non_empty_string"
          }
        },
        "optional_for": {
          "type": "array",
          "minItems": 1,
          "items": {
            "$ref": "#/$defs/non_empty_string"
          }
        },
        "avoid_for": {
          "type": "array",
          "minItems": 1,
          "items": {
            "$ref": "#/$defs/non_empty_string"
          }
        }
      }
    },
    "placement_execution_contract": {
      "type": "object",
      "additionalProperties": false,
      "required": [
        "cpu_affinity_policy",
        "smt_policy",
        "memory_policy",
        "helper_lane_policy",
        "required_environment_disclosures",
        "suite_selection",
        "focused_rerun",
        "fixed_knobs",
        "optional_knobs",
        "claim_contract",
        "violation_disposition"
      ],
      "properties": {
        "cpu_affinity_policy": {
          "$ref": "#/$defs/placement_cpu_affinity_policy"
        },
        "smt_policy": {
          "$ref": "#/$defs/placement_smt_policy"
        },
        "memory_policy": {
          "$ref": "#/$defs/placement_memory_policy"
        },
        "helper_lane_policy": {
          "$ref": "#/$defs/placement_helper_lane_policy"
        },
        "required_environment_disclosures": {
          "type": "array",
          "minItems": 1,
          "items": {
            "$ref": "#/$defs/non_empty_string"
          }
        },
        "suite_selection": {
          "$ref": "#/$defs/placement_suite_selection_contract"
        },
        "focused_rerun": {
          "$ref": "#/$defs/placement_focused_rerun_contract"
        },
        "fixed_knobs": {
          "type": "array",
          "minItems": 1,
          "items": {
            "$ref": "#/$defs/non_empty_string"
          }
        },
        "optional_knobs": {
          "type": "array",
          "minItems": 1,
          "items": {
            "$ref": "#/$defs/non_empty_string"
          }
        },
        "claim_contract": {
          "$ref": "#/$defs/placement_claim_contract"
        },
        "violation_disposition": {
          "$ref": "#/$defs/placement_violation_disposition"
        }
      }
    },
    "retention_class": {
      "type": "string",
      "enum": ["quick_run", "full_proof", "failure_bundle", "final_scorecard"]
    },
    "hardware_os_family": {
      "type": "string",
      "enum": ["linux"]
    },
    "hardware_cpu_architecture": {
      "type": "string",
      "enum": ["x86_64"]
    },
    "hardware_topology_class": {
      "type": "string",
      "enum": ["any", "many_core_numa"]
    },
    "hardware_class_id_fields": {
      "type": "object",
      "additionalProperties": false,
      "required": ["os_family", "cpu_arch", "topology_class"],
      "properties": {
        "os_family": {
          "$ref": "#/$defs/hardware_os_family"
        },
        "cpu_arch": {
          "$ref": "#/$defs/hardware_cpu_architecture"
        },
        "topology_class": {
          "$ref": "#/$defs/hardware_topology_class"
        }
      }
    },
    "fixture": {
      "type": "object",
      "additionalProperties": false,
      "required": [
        "fixture_id",
        "source_path",
        "source_sha256",
        "source_size_bytes",
        "working_copy_relpath",
        "working_copy_sha256",
        "working_copy_size_bytes",
        "page_size",
        "journal_mode",
        "capture_rule"
      ],
      "properties": {
        "fixture_id": {
          "$ref": "#/$defs/id"
        },
        "source_path": {
          "$ref": "#/$defs/non_empty_string"
        },
        "source_sha256": {
          "$ref": "#/$defs/sha256"
        },
        "source_size_bytes": {
          "type": "integer",
          "minimum": 1
        },
        "working_copy_relpath": {
          "$ref": "#/$defs/non_empty_string"
        },
        "working_copy_sha256": {
          "$ref": "#/$defs/sha256"
        },
        "working_copy_size_bytes": {
          "type": "integer",
          "minimum": 1
        },
        "page_size": {
          "type": "integer",
          "minimum": 1
        },
        "journal_mode": {
          "$ref": "#/$defs/non_empty_string"
        },
        "capture_rule": {
          "$ref": "#/$defs/non_empty_string"
        }
      }
    },
    "placement_profile": {
      "type": "object",
      "additionalProperties": false,
      "required": [
        "id",
        "kind",
        "description",
        "command_hint",
        "availability",
        "execution_contract"
      ],
      "properties": {
        "id": {
          "$ref": "#/$defs/id"
        },
        "kind": {
          "$ref": "#/$defs/placement_profile_kind"
        },
        "description": {
          "$ref": "#/$defs/non_empty_string"
        },
        "command_hint": {
          "$ref": "#/$defs/non_empty_string"
        },
        "availability": {
          "$ref": "#/$defs/placement_profile_availability"
        },
        "execution_contract": {
          "$ref": "#/$defs/placement_execution_contract"
        }
      }
    },
    "hardware_class": {
      "type": "object",
      "additionalProperties": false,
      "required": ["id", "id_fields", "min_logical_cores", "min_numa_nodes", "description"],
      "properties": {
        "id": {
          "$ref": "#/$defs/id"
        },
        "id_fields": {
          "$ref": "#/$defs/hardware_class_id_fields"
        },
        "min_logical_cores": {
          "type": "integer",
          "minimum": 1
        },
        "min_numa_nodes": {
          "type": ["integer", "null"],
          "minimum": 1
        },
        "description": {
          "$ref": "#/$defs/non_empty_string"
        }
      }
    },
    "retry_policy": {
      "type": "object",
      "additionalProperties": false,
      "required": ["id", "max_busy_retries", "busy_backoff_ms", "busy_backoff_max_ms", "notes"],
      "properties": {
        "id": {
          "$ref": "#/$defs/id"
        },
        "max_busy_retries": {
          "type": "integer",
          "minimum": 1
        },
        "busy_backoff_ms": {
          "type": "integer",
          "minimum": 1
        },
        "busy_backoff_max_ms": {
          "type": "integer",
          "minimum": 1
        },
        "notes": {
          "$ref": "#/$defs/non_empty_string"
        }
      }
    },
    "build_profile": {
      "type": "object",
      "additionalProperties": false,
      "required": ["id", "cargo_profile", "cargo_args", "notes"],
      "properties": {
        "id": {
          "$ref": "#/$defs/id"
        },
        "cargo_profile": {
          "$ref": "#/$defs/non_empty_string"
        },
        "cargo_args": {
          "type": "array",
          "items": {
            "$ref": "#/$defs/non_empty_string"
          }
        },
        "notes": {
          "$ref": "#/$defs/non_empty_string"
        }
      }
    },
    "seed_policy": {
      "type": "object",
      "additionalProperties": false,
      "required": ["id", "kind", "base_seed", "notes"],
      "properties": {
        "id": {
          "$ref": "#/$defs/id"
        },
        "kind": {
          "$ref": "#/$defs/non_empty_string"
        },
        "base_seed": {
          "type": "integer",
          "minimum": 1
        },
        "notes": {
          "$ref": "#/$defs/non_empty_string"
        }
      }
    },
    "placement_variant": {
      "type": "object",
      "additionalProperties": false,
      "required": ["placement_profile_id", "hardware_class_id", "required"],
      "properties": {
        "placement_profile_id": {
          "$ref": "#/$defs/id"
        },
        "hardware_class_id": {
          "$ref": "#/$defs/id"
        },
        "required": {
          "type": "boolean"
        }
      }
    },
    "matrix_row": {
      "type": "object",
      "additionalProperties": false,
      "required": [
        "row_id",
        "fixtures",
        "workload",
        "concurrency",
        "modes",
        "placement_variants",
        "retry_policy_id",
        "build_profile_id",
        "seed_policy_id"
      ],
      "properties": {
        "row_id": {
          "$ref": "#/$defs/id"
        },
        "fixtures": {
          "type": "array",
          "minItems": 1,
          "items": {
            "$ref": "#/$defs/id"
          }
        },
        "workload": {
          "$ref": "#/$defs/id"
        },
        "concurrency": {
          "type": "integer",
          "minimum": 1
        },
        "modes": {
          "type": "array",
          "minItems": 1,
          "items": {
            "$ref": "#/$defs/benchmark_mode"
          }
        },
        "placement_variants": {
          "type": "array",
          "minItems": 1,
          "items": {
            "$ref": "#/$defs/placement_variant"
          }
        },
        "retry_policy_id": {
          "$ref": "#/$defs/id"
        },
        "build_profile_id": {
          "$ref": "#/$defs/id"
        },
        "seed_policy_id": {
          "$ref": "#/$defs/id"
        }
      }
    },
    "artifact_contract": {
      "type": "object",
      "additionalProperties": false,
      "required": [
        "artifact_root_relpath",
        "bundle_dir_template",
        "bundle_key_template",
        "bundle_name_template",
        "manifest_schema_version",
        "result_jsonl_name",
        "summary_md_name",
        "manifest_name",
        "hardware_discovery_bundle_json_name",
        "hardware_discovery_summary_md_name",
        "logs_dir_name",
        "profiles_dir_name",
        "retention_policies"
      ],
      "properties": {
        "artifact_root_relpath": {
          "$ref": "#/$defs/non_empty_string"
        },
        "bundle_dir_template": {
          "$ref": "#/$defs/non_empty_string"
        },
        "bundle_key_template": {
          "$ref": "#/$defs/non_empty_string"
        },
        "bundle_name_template": {
          "$ref": "#/$defs/non_empty_string"
        },
        "manifest_schema_version": {
          "type": "string",
          "const": "fsqlite-e2e.beads_benchmark_artifact_manifest.v1"
        },
        "result_jsonl_name": {
          "$ref": "#/$defs/non_empty_string"
        },
        "summary_md_name": {
          "$ref": "#/$defs/non_empty_string"
        },
        "manifest_name": {
          "$ref": "#/$defs/non_empty_string"
        },
        "hardware_discovery_bundle_json_name": {
          "$ref": "#/$defs/non_empty_string"
        },
        "hardware_discovery_summary_md_name": {
          "$ref": "#/$defs/non_empty_string"
        },
        "logs_dir_name": {
          "$ref": "#/$defs/non_empty_string"
        },
        "profiles_dir_name": {
          "$ref": "#/$defs/non_empty_string"
        },
        "retention_policies": {
          "type": "array",
          "minItems": 4,
          "items": {
            "$ref": "#/$defs/retention_policy"
          }
        }
      }
    },
    "retention_policy": {
      "type": "object",
      "additionalProperties": false,
      "required": ["class", "description", "superseded_by_newer", "immutable", "authoritative"],
      "properties": {
        "class": {
          "$ref": "#/$defs/retention_class"
        },
        "description": {
          "$ref": "#/$defs/non_empty_string"
        },
        "superseded_by_newer": {
          "type": "boolean"
        },
        "immutable": {
          "type": "boolean"
        },
        "authoritative": {
          "type": "boolean"
        }
      }
    }
  }
}
